id;title;date;
385;До України завезли небезпечне м’ясо. Будьте обережні;2021-11-09 14:50:07;
386;За газ платитимемо по-новому не за куби, а за енерго одиниці...;2021-11-10 06:39:28;
387;В день Української мови бібліотеку у Прилуцькому районі  відвідав гість з Чикаго;2021-11-10 07:27:51;
388;Скоро може з’витися швидкісний потяг Чернігів-Київ;2021-11-10 08:06:40;
389;Перевірка якості продуктів харчування у домашніх умовах (відео);2021-11-10 15:09:27;
390;Органи охорони здоров’я Франції не рекомендують вакцину Moderna COVID-19 людям молодшим 30 років;2021-11-11 06:46:22;
391;В Україні вводять е-аудит, що дозволить проводити податкові перевірки без контакту податкового інспектора з підприємством;2021-11-11 06:46:52;
392;В Ічні обговорювали заходи техногенної безпеки та профілактики хвороб. Гімназія №1 на карантині до 21.11.2021;2021-11-11 10:16:22;
393;Чернігівський автозавод відвідали депутати;2021-11-11 10:47:31;
394;Плани розвитку громадського транспорту Чернігова;2021-11-11 19:31:14;
395;У Городні вимагають роз’яснень міської ради щодо оплати тестувань на корронавірусну інфекцію за рахунок вчителів;2021-11-12 07:00:53;
396;Мешканцям зруйнованого гуртожитка по вул. Попудренка 16 продлили всі угоди на проживання;2021-11-12 07:31:41;
397;В Ольшані ічнянського району ремонтують міст (фотозвіт);2021-11-12 13:11:43;
398;34 ноутбуки для вчителів Новгород-Сіверської громади;2021-11-12 13:26:03;
399;В Ічнянському районі висадили 2,3 га дерев (фотозвіт);2021-11-13 06:51:32;
400;Старостинські округи об’єднають відповідно до вимог чинного законодавства;2021-11-13 07:47:48;
401;Бобровицькій Молодіжній раді виповнюється рік;2021-11-13 07:56:46;
402;Чернігівобленерго повідомив - взимку можливі відключення електроенергії;2021-11-13 16:08:56;
403;"Прийом з особістих питань на ""виїзді"" проводила Новгород-Сіверська районна адміністрація";2021-11-14 06:33:58;
404;У Борзні відремонтовано стадіон (фотозвіт);2021-11-14 06:51:18;
405;В Тупичеві для представників громади проводили семінар (фотозвіт);2021-11-14 07:09:00;
406;Сільські та селищні очільники обговорювали питання взаємодії з підприємствами охорони здоров’я;2021-11-14 07:31:41;
407;У Прилуцькому районі вирішують проблеми зв’язку між округами територіальних громад;2021-11-15 06:32:25;
408;"Колишній дитячий табір ""Дружба"" змінив власника";2021-11-15 06:56:39;
409;Чернігівська самбістка Юлія Гребеножко виборола «золото» на чемпіонаті світу;2021-11-15 10:41:21;
410;Поліція Чернігівщини просить на допомогу у розшуку водія легковика що скоїв ДТП у Ніжині;2021-11-15 11:01:33;
411;Тупичівська територіальна громада розробляє новий Статут;2021-11-15 12:17:46;
412;З 1 січня в Україні всім ФОПам 2-4 групи потрібно мати касові апарати;2021-11-16 07:04:44;
413;Куліківська громада затвердила програму розвитку на 2021-2023 роки;2021-11-16 08:31:51;
414;У Ніжині литовським інвесторам презентували інвестиційні проекти;2021-11-16 12:13:13;
415;Міністерство освіти і науки рекомендує відновити очний освітній процес у школах;2021-11-17 06:06:20;
416;Чернігівський автозавод продав 27 автобусів;2021-11-17 07:01:18;
417;Поліція Прилуччини розшукує зниклого безвісти 16-річного хлопця;2021-11-17 10:42:20;
418;На Чернігівщині поліція викрила «банківського» шахрая;2021-11-18 06:29:04;
419;Чернігівськ райони об’єдналися - стели з назвами лишилися;2021-11-18 06:17:49;
420;У Новгород-Сіверському молодь долучилася до вирішення питань благоустрою міста;2021-11-18 08:42:26;
421;Бронзовий призер чемпіоната Європи з армспорту з Борзни;2021-11-18 10:38:46;
422;Чернігівські кік-боксери вибороли низку нагород на всеукраїнських змаганнях у Харкові;2021-11-18 19:51:22;
423;У Чернігові перекривається рух автотранспорту  на перехресті вул. Пухова з вул. Всіхсвятською;2021-11-18 20:07:03;
424;Віртуальний тур прилуцькою фортецею  запропонував краєзнавчий музей імені В.І.Маслова;2021-11-19 05:53:06;
425;Соціальна срямованість бюджету Чернігова у 2022 році - 366 мільйонів на соціальні програми;2021-11-19 13:03:43;
426;Облгаз ухиляється від виконання своїх зобов’язань? Газорозподільча система потребує ремонту - тепер її передають людям;2021-11-19 14:25:41;
427;Будьте обережні - Приват Банк повідомив про нову шахрайську схему;2021-11-20 07:11:08;
428;Кубок України з кікбоксингу проходить у Чернігові;2021-11-20 07:59:16;
429;Виставка керамічних іграшок-свищиків майстрині Ольги Баєвої відкрилася в чернігівському музеї Тарновського;2021-11-20 08:16:59;
430;Аварійні відключення в мережах - Чернігівобленерго ліквідує наслідки негоди;2021-11-21 06:32:54;
431;В Іржавці Ічнянського району пройшли змагання клубного чемпіонату Чернігівської області з настільного тенісу;2021-11-21 06:48:21;
432;Поліцейські Чернігівщини допомагають громадянам долати наслідки буревію;2021-11-21 07:09:59;
433;Сорт картоплі, який не цікавий колорадському жуку;2021-11-21 09:36:53;
434;У Новгород-Сіверському почали облагорожувати парк (фотозвіт);2021-11-22 06:14:08;
435;В Грем’ячі побудували амбулаторію, але не ввели в експлуатацію;2021-11-22 06:37:08;
436;В Чернігові цієї зими працюватимуть пункти обігріву;2021-11-22 07:37:25;
437;Чернігівводоканал запускає мобільний додаток для передачі показників;2021-11-22 07:51:21;
438;Черниговские велосипедисты получат комфортные условия для занятий;2021-11-22 14:27:16;
439;Ксерокопії паспорту більше не знадобляться;2021-11-23 06:26:14;
440;У Вихвостові небайдужі мешканці збудували спортивний майданчик (фотозвіт);2021-11-23 06:49:14;
441;Авомобильный мост возле Сновска в процессе капитального ремонта;2021-11-23 07:21:40;
442;На Черниговщине чрезвычайная ситуация социального характера;2021-11-23 08:08:22;
443;Чернігівщина осіння в об’єктиві - роботи фотохудожника з Городні Олександра Арендара;2021-11-23 15:08:56;
444;В Чернігівській області вдкрився 33 Центр надання адміністративних послуг;2021-11-23 13:42:43;
445;За первые месяцы работы камер фиксации, водителям Чернигова выписали 8049 протоколов.;2021-11-24 07:03:09;
446;Розпочалася спеціальна прикордонна операція для посилення охорони кордону з Білоруссю;2021-11-24 10:11:54;
447;Ковзанка та встановлення новорічної ялинки, як святкуватимуть Чернігівці цього року;2021-11-24 11:46:12;
448;Акція під міською радою проти знищення Ялівщини;2021-11-24 15:05:10;
449;Улицу Киевскую скоро откроют для транспорта;2021-11-25 09:04:08;
450;В селі Іваниця Ічнянського району багатодітна родина отримала нетельну корову;2021-11-25 09:03:54;
451;Черниговская областная больница завершает ремонт хирургического отделения;2021-11-25 09:51:29;
452;На Черниговщине земля с историческими памятниками в 2 тыс лет ушла с молотка. Прокуратура признала сделку незаконной.;2021-11-25 10:27:18;
453;В Ичне хотят возобновить работу автостанции;2021-11-25 14:51:06;
454;В Новгород-Северском искали новые подходы в сельском хозяйстве в условиях изменения климата;2021-11-26 07:19:12;
455;Мер обещал - люди не верили. Акция против приватизации Еловщины;2021-11-26 08:15:36;
456;У Прилуках оптимізували вуличне освітлення та навчальні заклади;2021-11-26 09:08:11;
457;Профспілка освітян та науковців України продовжує кампанію з захисту прав непривитих працівників.;2021-11-26 10:06:16;
458;Первую партию радиоактивных отходов передали в Центральное хранилище в Чернобыле;2021-11-26 13:10:19;
459;Сховище вогнепальної зброї буле знайдено полбизу кордону Росії та Білорусії (фото);2021-11-26 14:22:47;
460;Чернігівська облспоживспілка відкрила новий продуктовий магазин в Городні;2021-11-27 06:34:52;
461;Новий автобус та нова роздягальня на стадіоні - Талалаївка з обновками, а депутати пропіарилися;2021-11-27 07:06:27;
462;Ювілей у 100 років відзначала громада Рибинського старостинського округу;2021-11-27 07:50:59;
463;Чернігівському театру ляльок виповнилося 45 років;2021-11-27 08:21:26;
464;Остання субота листопада день пам’яті жертв голодомора;2021-11-27 20:09:33;
465;Перевернулся трактор, погиб мужчина;2021-11-28 06:46:45;
466;В Гончаровске начала работу станция полиции;2021-11-28 07:08:53;
467;На дерев’яному мості у Коропі застрягла вантажівка (фотозвіт);2021-11-28 07:35:18;
468;Прилуцкие легкоатлеты завоевали первенство на чемпионате Полтавской области;2021-11-28 16:35:02;
469;В Чернігівській області знешкодили протитанкову міну другої світової вйни;2021-11-28 20:09:25;
470;В Корюківській РДА хочуть налагодити поставки зрідженого газу;2021-11-28 20:37:42;
471;"""Кудрівка-2"" та ""Прогрес"" з Остапівки завершили футбольний сезон 2021 року на Чернігівщині";2021-11-29 07:17:16;
472;Куліківська громада створює простір для навчання підприємницькій діяльності та профоріентації молоді;2021-11-29 07:43:20;
473;Через пошкодження тепломережі - в Ніжині деякі будинки без опалення;2021-11-29 08:15:37;
474;Бардак на Музыкальной, 9 в Чернигове;2021-11-29 12:03:24;
475;Убийство по неосторожности. В Черниговской области погиб полицейский;2021-11-29 14:15:36;
476;Завершується ремонт дороги у с. Киїнка;2021-11-29 17:16:20;
477;Музею імені В.В. Тарновського виповнилося 125 років;2021-11-29 19:27:52;
478;Грошові перекази Українців перевірятимуть за новими правилами;2021-11-30 06:34:31;
479;Незареєстровані мобільні телефони можуть відключити;2021-11-30 07:10:23;
480;Сильный ветер оставил  без електричества 63 населенных пункта в Черниговской области;2021-11-30 10:24:40;
481;В Черниговской области еще 8 населенных пунктов получили скоростной интернет;2021-11-30 14:52:35;
482;Активисты добились конструктивного решения по Еловщине;2021-11-30 19:04:17;
483;В Черниговской области пройдет международный фестиваль документального кино;2021-12-01 08:06:23;
484;Громадянин Китаю та білоруський виробник теплоізоляції хочуть придбати Козелецький льонозавод;2021-12-01 09:05:29;
485;Бесплатных пластиковых пакетов в магазинах больше не будет;2021-12-01 10:35:50;
486;В Чернігівській області у співробітників харчоблоків навчальних закладів було виявлено стафілокок;2021-12-01 14:52:05;
487;Около пятисот жителей железнодорожного общежития под угрозой выселения;2021-12-01 17:54:43;
488;У День боротьби зі СНІДом в Чернигівській ОДА пройшов брифінг;2021-12-02 06:17:36;
489;В Чернігові визначили переможців конкурсу проектів які спрямовані на роботу з молоддю;2021-12-02 06:46:50;
490;Міська рада планує підняти ціни на харчування дітей в закладах освіти;2021-12-02 07:03:24;
491;В Чернігові горіла маршрутка;2021-12-02 08:29:32;
492;Село Нехаївка Коропської громади отримала свою амбулаторію;2021-12-02 08:52:06;
493;Поліція Чернігівської області запускає сервіс на основі Гугл карт;2021-12-02 09:52:16;
494;На Чернігівщині зафіксували проблеми з питною водою;2021-12-02 15:02:10;
495;На Чернігівщині прикордонники проводили масштабні навчання;2021-12-03 06:03:49;
496;Мешканець Ніжина залишив без води людей з 3 вулиць;2021-12-03 06:22:22;
497;ЛІга ділових та професійних жинок України проводитиме форум в Чернігові;2021-12-03 06:49:56;
498;Чернігівські родини отримають допомогу при народженні дитини;2021-12-03 07:16:37;
499;Самые большие зарплаты в Черниговской области в Прилуцком районе;2021-12-03 07:38:56;
500;Около сотни объектов демонтируют в Чернигове;2021-12-03 10:16:38;
501;Колишній посадовець з управління юстиції Чернігівської області отримав реальний строк;2021-12-03 11:43:40;
502;У Коропі переймають кращий европейській досвід;2021-12-04 06:00:28;
503;"Реабілітаціний  центр ""Відродження"" вже 25 років надає допомогу тисячам хворим дітям";2021-12-04 06:45:57;
504;У Ніжині вандали псують щойно відремонтовану алею;2021-12-04 08:44:34;
505;Корюківський центр дитячої та юнацької творчості проводив конкурс;2021-12-04 09:31:45;
506;"У Тупичевській громаді запрацює програма ""соціальний велосипед""";2021-12-04 09:58:07;
507;Переможці обласного конкурс патріотичних відеороликів отримали призи;2021-12-04 13:02:53;
508;"Первый Черниговский небоскреб повится в районе ""Градецкого""";2021-12-05 11:03:18;
509;В Черниговской области 650 га земли незаконно передали в аренду;2021-12-06 06:44:26;
510;В Новгород-Северском откроют центр развития предпринимательства;2021-12-06 07:16:17;
511;Поліція Чернігівщини та три громади підписали меморандум про співпрацю;2021-12-06 08:16:40;
512;В 2022 году Варва планирует выделить 450 000 гривен на жилье и поощрения медработников;2021-12-06 09:26:11;
513;В Верховной Раде предлагают вернуть государственное регулирование цен на продукты питания;2021-12-06 13:24:37;
514;"В Мені відкрито ""соціальну пральню""";2021-12-06 13:56:49;
515;В Ичне разыскивают 30-летнего Сергея Боршоша;2021-12-06 14:11:48;
516;Возле Брусилова авария в маршрутке погибло 11 пассажиров.;2021-12-07 08:28:18;
517;В результате неблагоприятных погодных условий без электроснабжения остаются жители 46 населённых пунктов в Черниговском районе;2021-12-07 09:00:06;
518;Боксеры Черниговщины завоевали призовые места;2021-12-07 10:41:56;
519;В Нежине открыли социальный хаб для людей с инвалидностью;2021-12-07 17:01:16;
520;На форумі Ліги ділових та професійних жінок обговорювали партнерство (відео);2021-12-08 07:15:41;
521;"Черниговский музей им. Тарновского открыл выставку ""Индия. В поисках сказки""";2021-12-08 06:54:20;
522;В Прилуках боролись с трудоголизмом;2021-12-08 11:35:25;
523;Из-за погоды троллейбусы в Чернигове работают с перебоями;2021-12-08 15:11:54;
524;Сильный гололед;2021-12-08 16:54:30;
525;В Новгород-Северском депутат не доволен качеством ремонта моста;2021-12-09 06:16:37;
526;Депутатській подарок або дерибан землі? У Бахмачскому районі подарували 18 га;2021-12-09 07:27:22;
527;Як Іванов завод захищав (відео);2021-12-09 08:46:06;
528;Поліція Новгород-Сіверського оголосила підозру посадовцю про підробку документів;2021-12-09 14:50:09;
529;Колишній кінотеатр Щорса, або молодіжний центр отримає нове життя;2021-12-09 13:01:14;
530;Правила безопасности в гололед;2021-12-09 14:18:18;
531;В детской поликлинике на Рокосовского работают бассейны;2021-12-10 05:12:35;
532;Подготовка к празднику идет полным ходом;2021-12-10 05:27:55;
533;В Чернигове в следующем году начнут строительство ледовой арены;2021-12-10 08:36:47;
534;Прокуроры против депутатов - счет 6:3;2021-12-10 08:57:37;
535;Никогда такого не было и вот опять! Еловщину продолжают планомерно выпиливать (фото).;2021-12-10 10:10:36;
536;В Більмачівці запустили освітлення вулиць, або машина часу на Ічнянщині;2021-12-10 10:52:42;
537;Мужчину подрезавшего 15-летнего подростка в Чернигове - арестовали на 2 месяца;2021-12-10 11:21:51;
538;В Чернігові мітингувальники засудили обмеження прав українців в рамках законопроекту 4142;2021-12-12 18:16:30;
539;Черниговщина налаживает связи с Северной Македонией;2021-12-12 20:23:23;
540;В Талалаеке прошел турнир по бильярду;2021-12-13 06:31:56;
541;В Ніжині із 103 річчам привітали відому викладачку;2021-12-13 06:58:08;
542;З 18 грудня Дід Мороз відкриє офіс в Чернігові;2021-12-13 09:03:02;
543;Чернігів стає безпечнішим;2021-12-13 12:53:14;
544;В Прилуках презентовали экологичный автобус;2021-12-13 13:47:07;
545;Збірна Чернігівщини посіла призове міцє на Кубку України з настільного тенісу;2021-12-14 06:52:01;
546;Сергей Андрос оспаривает решение о постройке высотки во дворе Черниговской ОГА;2021-12-14 07:10:13;
547;Вишки мобільного зв’язку, молодіжний клуб, харчоблок для ДНЗ - у Корюківці затвердили бюджет;2021-12-14 07:42:17;
548;Осторожно!!! В Киеве обнаружили мясо зараженное сальмонелезом;2021-12-14 08:42:56;
549;В Чернігові суд визнав неправомірним відсторонення від роботи через відсутність вакцінації;2021-12-14 15:04:50;
550;В Чернігові судитимуть педофіла що протягом 2018-2021 років гвалтував неповнолітніх;2021-12-14 16:10:48;
551;Вигадували колесо, або як на Чернігівщині почали процес передачі газогону у власність громад;2021-12-15 07:03:05;
552;Новый детский сад в Коптях;2021-12-15 08:15:14;
553;Святкові ялинки та канікули - Чернігів готується до Нового року;2021-12-15 09:41:46;
554;В Березовой роще на Пухова строят систему водоотвода;2021-12-15 10:44:55;
555;Главный зал Черниговского почтамта закрыли;2021-12-15 12:35:41;
556;Варва выделила 300 000 грн на охрану природы;2021-12-15 13:16:21;
