id;title;date;
557;Чернігівець обурений вирубкою дерев та застройкою ганделиками поширив відкрите звернення через Фейсбук;2021-12-15 13:57:42;
558;В Халявине новая амбулатория;2021-12-16 06:45:57;
559;"В пятницу, во Дворце культуры ""Химиков"" мер презентует отчет о проделанной работе за 2021 год";2021-12-16 06:56:05;
560;"Заповедник ""Гентьманська столиця"" в этом году получил много предметов связанных с историей Украины";2021-12-16 07:15:18;
561;Чернигов начнет праздновать 19 декабря;2021-12-16 09:04:08;
562;18 декабря Дмитрий Митрофанов проведет рейтинговый бой в Броварах;2021-12-16 13:08:44;
563;Министр внутренних дел посетил Нежин;2021-12-16 16:27:02;
564;Прилуцькі школяри отримали дидактичні матеріали;2021-12-16 16:47:23;
565;Платить за детские кружки в Чернигове придется больше;2021-12-17 05:48:53;
566;В Ічні поновлено роботу автостанції;2021-12-17 06:25:43;
567;В Ніжині вперше відбудеться новорічний ярмарок;2021-12-17 07:32:51;
568;В селе Холмы Корюковского района открыли современный тренажерный зал;2021-12-17 08:20:54;
569;"В Чернигове поздравили победительниц конкурса ""Женщина года -2021""";2021-12-17 08:35:25;
570;"В Мені на Святого Миколая велопробіг ""ВелоМиколайчики:)"" та поздоровлення малечі";2021-12-17 14:43:44;
571;У Новгород-Сіверському хочуть продати Леніна;2021-12-17 15:21:32;
572;Центральная библиотека Нежина провела мастер класс для детей по изготовлению новогодних игрушек;2021-12-18 06:56:56;
573;В селі Камка, Холминської териториальної громади відкрили краєзнавчий музей;2021-12-18 08:14:46;
574;Завтра у Деда Мороза в Чернигове плотный график;2021-12-18 12:51:11;
575;Робота заслуженого художника України Анатолія Шкурко прикрашає відділення укрпошти в Мені;2021-12-18 15:44:38;
576;В Чернигове открыли новогодние базары.  Где купить елку?;2021-12-19 07:33:34;
577;Сьогодні Прилуки запялять новорічні вогники на центральній площі міста.;2021-12-19 08:50:32;
578;Чернігівський боксер Дмитро Мітрофанов переміг у 3 раунді;2021-12-19 09:23:49;
579;Фермеры провели Всеукраинские слушания о незаконности продажи земли в Украине;2021-12-19 09:51:59;
580;В Бахмачі депутат міської ради насмерть збив велосипедиста;2021-12-19 11:55:04;
581;В Бахмачі святково відкрили Новорічну Ялинку (фотозвіт);2021-12-20 06:51:16;
582;У Новгород-Сіверському на Миколая відбулись урочисті заходи (фотозвіт);2021-12-20 07:00:47;
583;Як до Коропа завітав справжній Дід Мороз;2021-12-20 07:15:11;
584;В Ніжині почали святкувати (фотозвіт);2021-12-20 07:22:33;
585;У Прилуках також святкували (фотозвіт);2021-12-20 07:26:42;
586;В Бахмаче люди вышли на митинг что бы полиция не замяла дело депутата, который сбил насмерть человека;2021-12-20 10:59:24;
587;"В Коптях торжественно открыли детский сад ""АИСТ""";2021-12-20 15:02:30;
588;В Новгород-Северском горсовет огласил конкурс на лучшее оформление фасада дома;2021-12-21 06:55:55;
589;Як в Семенівці на Миколая святкували (відео);2021-12-21 07:21:09;
590;Сьогодні День зимового сонцестояння;2021-12-21 08:20:15;
591;День Святого Миколая в Чернигове;2021-12-21 08:45:42;
592;В новогоднюю ночь в Чернигове будет работать общественный транспорт;2021-12-21 09:25:31;
593;В Чернигове на Пухова в ливневку годами сливали фекалии и они попадали в Десну;2021-12-21 11:16:57;
594;;;
595;В Мене через ОЛХ продают отель;2021-12-22 06:29:06;
596;В Коропе рыбак поймал гигантского сома;2021-12-22 06:40:49;
597;"На Чернігівщині авіація зробила перший ""санітарний"" виліт";2021-12-22 07:14:20;
598;Легальные ёлки от лезхозов по нормальной цене!;2021-12-22 13:09:12;
599;На Черниговщине легковушка попала под поезд;2021-12-22 13:42:13;
600;"В Чернигове прошел турнир по кикбоксингу ""Зимняя перчатка""";2021-12-23 05:59:31;
601;З Брянського заповідника до Чернігівщини завітали зубри;2021-12-23 06:46:48;
602;В Корюковке молодой специалист медик получил служебную квартиру;2021-12-23 07:04:48;
603;"Чернігівська самбістка Софія Спицина здобула ""бронзу""";2021-12-23 07:26:51;
604;Чернігівщина займає 20 місце серед 25 областей України по євроінтеграції;2021-12-23 10:31:33;
605;Згідно наказу №313 МінОборони України жінки більше 100 професій, повинні стати на військовий облік;2021-12-24 06:18:02;
606;В Чернігівській області начальник райвідділу поліції вимагав хабаря у 20 тисяч доларів;2021-12-24 06:50:47;
607;Заканчивают ремонт моста в Коропе;2021-12-24 08:33:15;
608;Села Чернігівщини переходять на скраплений газ;2021-12-24 08:45:28;
609;10 миллионов грн на Прилуцкую больницу;2021-12-24 09:49:19;
610;Роз’яснення МінОборони України, щодо взяття на військовий облік жінок;2021-12-25 05:30:52;
611;Сразу 2 спортивных объекта начнут строить в Чернигове в следующем году;2021-12-25 06:16:39;
612;Шесть больниц в Черниговской области укомплектовали новой диагностической аппаратурой;2021-12-25 06:37:19;
613;В Черниговской области прокуратура  вернула  государству 48 га земли;2021-12-25 12:39:40;
614;Ніжин колядує (фотозвіт);2021-12-26 06:58:53;
615;Определили границы територии лесопарка Еловщина;2021-12-26 08:10:00;
616;В Коропе проводят чемпионат Черниговской области по волейболу;2021-12-27 06:28:12;
617;В Мене утвердили бренд города;2021-12-27 06:57:51;
618;Новые тарифы в новом году.;2021-12-27 09:44:26;
619;В Корюковке прошел  турнир по боксу;2021-12-28 06:38:59;
620;В Нежинском районе предприниматель заготавливал елки с кладбища и повредил могилы;2021-12-28 06:56:49;
621;В Черниговском районе загорелся тепловоз;2021-12-28 12:17:48;
622;Юные биатлонисты Черниговщины на пьедестале чемпионата Украины;2021-12-28 14:14:10;
623;В Новогоднюю ночь в Чернигове будет работать общественный транспорт: 4 троллейбусных и 8 автобусных маршрутов;2021-12-29 07:14:21;
624;Камер фиксации ПДД в Черниговской области может стать больше;2021-12-29 10:55:11;
625;Черниговский автозавод планирует начать производство грузовых авто;2021-12-29 11:38:01;
626;Здорожчання хлібних виробів або закриття хлібзаводу - працівники звернулися до голови Чернігівської ОДА;2021-12-29 19:40:56;
627;Полицейские Черниговщины прекратили деятельность международного мошеннического колл-центра;2021-12-30 13:46:33;
628;У іваницькій бібліотеці ВІДКРИЛИ  виставку раритетних новорічних іграшок;2022-01-03 14:58:29;
629;Как будут праздновать Рождество в Чернигове: «коза», рекорд и большой кулеш под открытым небом.;2022-01-03 16:01:45;
630;На Чернігівщині п'яний поліцейський спровокував ДТП: в аварії загинула людина;2022-01-04 08:44:33;
631;Куда девать новогоднее дерево после праздников?;2022-01-05 09:52:36;
632;ЛОР отделение в Черниговской областной больнице;2022-01-05 12:05:25;
633;Приглашение на фестиваль в Сосницу;2022-01-05 12:20:26;
634;1 января 2022 в Чернигове родилось 13 малышей!;2022-01-05 12:51:25;
635;Отчет полиции Чернигова о результатах работы за 2021 год;2022-01-05 13:09:58;
636;Рождественские традиции на Черниговщине;2022-01-06 11:06:53;
637;Материальная помощь от города;2022-01-06 11:36:16;
638;Большая стройка Чернигов;2022-01-06 11:58:11;
639;Безопасный пешеходный переход;2022-01-06 12:07:18;
640;"В Прилуках предложили ""культурную схему"" для реализации ""ковидной"" тысячи";2022-01-07 08:58:13;
641;Украинцы потихоньку начинают использовать новые деньги: чем могут заменить гривны;2022-01-07 09:13:37;
642;Зимові гриби;2022-01-07 11:15:46;
643;Первый заместитель председателя Черниговской ОГА;2022-01-07 11:49:37;
644;Ухудшение погодных условий;2022-01-07 11:56:52;
645;Закрывают две школы в Нежине;2022-01-07 12:03:49;
646;Как Черниговский городской совет принимал колядников;2022-01-07 12:17:50;
647;Современный леговой автомобиль для Варвинского сельсовета;2022-01-08 11:41:02;
648;У Новгород-Сіверському переймаються збереженням зеленої зони;2022-01-08 12:22:13;
649;Іржавецький «Лас-Вегас» - як село на Чернігівщині прикрасили до свят (відеозвіт);2022-01-08 12:57:57;
650;Пробное ЗНО;2022-01-08 14:57:49;
651;У Борзні стартував чемпіонат з футзалу;2022-01-09 08:49:24;
652;В Семенівці провели турнір з волейболу;2022-01-09 08:52:36;
653;"В Чернігові пройшов турнір з настільного тенісу ""Різдвяні зутрічі""";2022-01-09 09:04:17;
654;Юные каропчане одержали победы в соревнованиях по авиамодельному спорту (Фото);2022-01-09 10:12:57;
655;Фото с фестиваля в Соснице;2022-01-09 11:17:51;
656;Разрушается историческая памятка в Семеновке;2022-01-10 08:16:23;
657;Не ходят автобусы;2022-01-10 09:00:41;
658;Проверка питьевой воды в Чернигове показала;2022-01-10 09:42:33;
659;Складна ситуація навколо Семенівського лісгоспу;2022-01-10 13:48:51;
660;Ічнянська міська лікарня підбила підсумки;2022-01-10 15:05:56;
661;Женщину нашли;2022-01-11 05:14:03;
662;Установлены границы ландшафтного заказника Муравьевский;2022-01-11 05:16:31;
663;Сосница осваивает электронные петиции;2022-01-11 05:16:52;
664;Оскар за наилучшее украшение дома;2022-01-11 05:17:07;
665;Стоимость паспорта и загранпаспорта с 01.01.22;2022-01-12 06:18:54;
666;За газ будем платить дороже;2022-01-12 06:20:31;
667;Перекрыли газ. Что делать?;2022-01-13 07:57:44;
668;Шахматы сближают. Чемпионат Черниговской области;2022-01-12 06:42:30;
669;Новий підхід до харчування в навчальних закладах області.;2022-01-12 06:21:09;
670;Нежин образец для подражания!;2022-01-12 07:03:08;
671;Урон в 19 сомов каждый по 42 кг и две тонны рыбы;2022-01-12 07:48:12;
672;Финансироваться из городского бюджета будут:;2022-01-13 07:58:42;
673;Три пункта обогрева на Чернигов;2022-01-12 14:21:03;
674;ФК Десна закроют?;2022-01-13 07:58:13;
675;Выставка картин 4/22;2022-01-13 08:00:16;
676;Чиновницу Госгеокадастра подозревают в незаконной передаче земли;2022-01-12 18:24:18;
677;В Прилуках открыли дверь два пункта обогрева;2022-01-12 18:27:29;
678;В Прилуках исполком заключил временный договор на перевозку по маршруту №16;2022-01-12 18:30:43;
679;В 2021 году промысловые рыбаки Черниговщины выловили более 50 тонн рыбы;2022-01-12 18:53:07;
680;Засевалки и поздравления от сайта 24city;2022-01-14 07:28:16;
681;В Сребном открыли Студию спортивного досуга для женщин;2022-01-13 10:27:03;
682;Площадь заповедных территорий Черниговщины увеличивается;2022-01-14 07:27:28;
683;Пенсии повышены. Кому на сколько:;2022-01-14 07:27:54;
684;Сортировочная станция мусора в Чернигове;;
685;Отдай старые книги - подари добро!;2022-01-14 07:28:37;
686;На выходных Чернигов сортировочная станция устроит «приемные дни» для вторичного сырья;2022-01-13 16:43:12;
687;Нежинский молодежный центр приглашает на on-line тренинг;2022-01-14 11:30:56;
688;"""Вічна калюжа"" в Козельці. Люди не можуть вирішити проблему дренажу вулиці (відео)";2022-01-14 11:54:28;
689;Внимание конкурс!;2022-01-14 12:23:40;
690;Валерий Зуб;2022-01-15 07:28:15;
691;10 высокооплачиваемых профессий на Черниговщине:;2022-01-15 07:27:08;
692;Регулирование цен;2022-01-15 07:21:46;
693;Штраф 40 800 грн.;2022-01-15 07:27:54;
694;Полицейский не указал в декларации 78 000 долларов;2022-01-15 07:27:29;
695;Прилуцкие легкоатлеты ДЮСШ привезли 17 наград из Чемпионата Черниговской области;2022-01-14 15:43:07;
696;Черниговские детсады и школы полностью перешли на новую систему питания;2022-01-14 15:48:47;
697;Чернігівські дитячі садки та школи повністю перейшли до нової системи харчування.;2022-01-14 15:48:47;
698;Прилуцкие легкоатлеты ДЮСШ привезли 17 наград из Чемпионата Черниговской области;2022-01-14 15:43:07;
699;10 высокооплачиваемых профессий на Черниговщине:;2022-01-15 07:27:08;
700;Полицейский не указал в декларации 78 000 долларов;2022-01-15 07:27:29;
701;Штраф 40 800 грн.;2022-01-15 07:27:54;
702;Валерий Зуб;2022-01-15 07:28:15;
703;Регулирование цен;2022-01-15 07:21:46;
704;Внимание конкурс!;2022-01-14 12:23:40;
705;"""Вічна калюжа"" в Козельці. Люди не можуть вирішити проблему дренажу вулиці (відео)";2022-01-14 11:54:28;
706;Нежинский молодежный центр приглашает на on-line тренинг;2022-01-14 11:30:56;
707;Отдай старые книги - подари добро!;2022-01-14 07:28:37;
708;Засевалки и поздравления от сайта 24city;2022-01-14 07:28:16;
709;Пенсии повышены. Кому на сколько:;2022-01-14 07:27:54;
710;Площадь заповедных территорий Черниговщины увеличивается;2022-01-14 07:27:28;
711;На выходных Чернигов сортировочная станция устроит «приемные дни» для вторичного сырья;2022-01-13 16:43:12;
712;Сортировочная станция мусора в Чернигове;;
713;В Сребном открыли Студию спортивного досуга для женщин;2022-01-13 10:27:03;
714;Выставка картин 4/22;2022-01-13 08:00:16;
715;Финансироваться из городского бюджета будут:;2022-01-13 07:58:42;
716;ФК Десна закроют?;2022-01-13 07:58:13;
717;Чернігівобленерго працює над усуненням наслідків негоди;2022-01-15 20:17:58;
718;В Ніжнській бібліотеці презентували нову книгу про село Козари Ніжинського району;2022-01-16 07:28:09;
719;Данилівську школу закрито, вчителі вже тривалий час без роботи - хто винен?;2022-01-16 08:49:04;
720;Первый за десять лет!;2022-01-16 14:04:04;
721;Юна спортсменка з Вертіївки виборола бронзу;2022-01-17 07:08:43;
722;Квартирник в Мені;2022-01-17 07:43:21;
723;Ніжин запрошує на Творчу Тусу;2022-01-17 08:43:56;
724;Родители против закрытия школ!;2022-01-17 09:51:54;
725;Шить стало проще! Обучится можно в Чернигове по ул. Козацька 11а;2022-01-17 10:15:42;
726;З кожного Чернігівця по 1000 грн. в рік на пакети!;2022-01-18 06:34:35;
727;Скорочення населення України до 41,34 млн.;2022-01-19 06:17:46;
728;Ошукали хворих на туберкульоз дітей!;2022-01-18 06:34:07;
729;Счастливые улыбки жителей Городни;2022-01-18 06:33:38;
730;Увага! Конкурс для молоді!;2022-01-18 06:33:53;
731;Фронт-офіс поліції відкрито в Корюківці;2022-01-17 18:32:21;
732;42 населених пункти Чернігівщини знеструмлено внаслідок шкавльного вітру;2022-01-18 07:36:07;
733;«Облтеплокомуненерго» повернеться у власність міста;2022-01-18 14:32:26;
734;19 січня - Водохреща! Народні прикмети на Водохрещу;2022-01-19 06:17:04;
735;Пожар из-за заряжающегося планшета;2022-01-19 06:17:27;
736;Прокуратура добилась возвращения;2022-01-19 06:18:02;
737;Мандруємо Україною! Парк Беремицьке;2022-01-20 06:31:01;
738;Куліківський ОСББ не може впоратись з капітальним ремонтом;2022-01-20 06:30:57;
739;Незаконні вирубки в Чорнобилі;2022-01-20 06:30:51;
740;Інша Тиша в Чернігові;2022-01-19 14:19:18;
741;Скільки сміття здали на переробку за 2021 рік в Чернігові. Інфографіка;2022-01-21 06:51:59;
742;Носівка - відремонтовано стадіон;2022-01-21 06:52:18;
743;Красуня у вишиванці с.Гнідинці;2022-01-21 06:52:35;
744;Поліцейські затримали раніше судимого мешканця Ічні за підозрою у торгівлі зброєю;2022-01-21 06:52:52;
745;Припинення набору у 10 класи шкіл Чернігова;2022-01-20 15:48:51;
746;Чи почує влада потреби мешканців мікрорайона Нафтобаза Лісковиця ?;2022-01-21 06:53:09;
747;Побачив сміттєзвалище - дзвони: 0800 500 115;2022-01-22 06:25:04;
748;В Мені безробітним пропонують взяти патронат над дитиною;2022-01-22 06:25:43;
749;В Любечі з’явилась своя молодіжна рада;2022-01-22 06:27:01;
750;"Відбулися перші торги ""соціальним газом""";2022-01-21 15:37:26;
751;Мандруй не виходячи з дому! Сьогодні онлайн екскурсія в Батурин;2022-01-22 06:24:42;
752;Иновации для сохранности кормов;2022-01-22 06:24:51;
753;В Ладані відкрився центр культури та дозвілля;2022-01-22 10:31:46;
754;У Сновську горіла церква;2022-01-22 10:57:24;
755;Форнетти на грани остановки производства;2022-01-23 06:45:18;
756;57% українців підтримують ідею заборони цирків із тваринами;2022-01-23 06:44:55;
757;Більш тижня повалене дерево перекриває дорогу біля села Деревини;2022-01-22 15:58:33;
758;Пройшли збори села ВИПОВЗІВ, яких люди чекали 3 роки. Вирували пристрасті....;2022-01-23 07:51:44;
759;В Бобровиці жінка купила ковбасу із саморізом всередині;2022-01-23 10:28:34;
760;Зберегти раритетну будівлю в Сновську;2022-01-24 06:55:12;
761;Скандал в Носівці;2022-01-24 06:55:30;
762;Опровержение фэйковых новостей;2022-01-24 06:55:47;
763;Незаконна вирубка у прикордонному районі Чернігівщини;2022-01-24 06:56:22;
764;Взрыв котла на торфозаводе в Семеновке;2022-01-25 06:22:24;
765;Контейнери з відпрацьованим ядерним паливом у Чорнобильську зону;2022-01-25 10:27:54;
766;ДСНС України попереджає любителів зимової рибалки;2022-01-25 06:24:35;
767;Седнівська ГЕС;2022-01-25 06:23:01;
768;Криза в Прилуках;2022-01-25 09:16:38;
769;Холодно без газопостачання 222 домогосподарства на Чернігівщині;2022-01-25 10:51:57;
770;Відмовили в прийнятті документів на конкурс Начальник відділу благоустрою Деснянської ТГ;2022-01-26 07:42:43;
771;Тобі 17 років? Крокуй до військомату;2022-01-26 07:42:25;
772;Голова Корюківської РДА Ващенко;2022-01-26 08:30:33;
773;Ціни на гарячу воду зменшено;2022-01-26 08:47:27;
774;"Перехід на дистанційне навчання руйнує плани ""телефонних терористів""";2022-01-26 09:41:52;
775;Реконструйовано амбулаторію;2022-01-26 09:49:17;
