id;title;date;
213;На чемпіонаті України велосипедистки з Чернігова здобули 11 медалей;2021-10-06 13:15:26;
214;В Николаеве с билбордов призывают учителей поддерживать ЛГБТ-учеников;2021-10-06 13:43:01;
215;Чернігівщина - наболіла тема опалювальний сезон. Новогорд-Сіверський термінова нарада з питань опалення;2021-10-07 04:41:58;
216;На Чернігівщині пасічники отримають дотації;2021-10-07 04:41:35;
217;У селі на Ніжинщині висохла річка і колодязі селяни б’ють на сполох;2021-10-07 04:41:10;
218;Як правильно збирати та зберігати врожай груш та яблук. Поради професіоналів;2021-10-07 05:17:51;
219;Українському сільському господарству хочуть допомогти стати більш кліматично орієнтованим;2021-10-08 05:46:42;
220;Басейн збудували а почати експлуатацію не можуть - немає рішення міської ради;2021-10-07 06:28:49;
221;У Талалаївці на Прилуччині пройшов турнір з міні-футболу для дівчат;2021-10-07 07:05:02;
222;На Чернігівщині телефонні шахраї атакують підприємців намагаючись видурити кошти;2021-10-07 07:24:26;
223;Сбой в работе WhatsApp, Instagram и Facebook подарил меседжеру Telegram 70 000 новых пользователей;2021-10-07 12:09:31;
224;В Індії нагородили поетів з Чернігова;2021-10-08 05:43:09;
225;Рейдери у селі Кути Семенівського району Чернігівській області, захопили більше 2 тисяч га з врожаєм. (Відео);2021-10-08 06:06:02;
226;В Ніжині з’явився світло-музичний фонтан (фотозвіт від мера);2021-10-08 06:33:59;
227;Пішов із життя Антон Поляков, народний депутат України. Чи була його смерть природньою?;2021-10-08 07:48:36;
228;Директор школи подав на Кабмін у суд через обов'язкову вакцинацію вчителів;2021-10-08 09:56:22;
229;Батьківський комітет звернувся до мера Чернігова. Діти мерзнуть в дітсадку без опалення. Мер пропонує закривати дітсадок(фото, відео);2021-10-09 06:58:11;
230;В Ніжині з’явилися громадські загальнодоступні станції для ремонту велосіпедів (фотозвіт);2021-10-09 06:33:30;
231;Розмножуємо виноград методом живця, та що для цього слід зробити восени;2021-10-09 06:47:40;
232;У Борзні будують нову свердловину для забору питної води;2021-10-09 08:20:03;
233;Петиція про кримінальну відповідальність за примусову вакцинацію набрала необхідні голоси;2021-10-09 10:35:31;
234;Ракетомоделісти з Ніжина посіли призові місця на Чемпіонаті світу;2021-10-10 07:10:44;
235;У Сновську збирають підписи щоб відновити дорогу;2021-10-10 07:31:37;
236;Економія опалення на знаннях учнів. В Прилуцьких школах канікули на 4 дні довші.;2021-10-10 08:55:16;
237;Інтерв’ю Руслана Коцаби з Народним депутатом України Олександром Качним про коронавірусний психоз, локдауни і законопроект 4142 (відео);2021-10-10 08:28:06;
238;Олімпійський чемпіон, легкоатлет Сергій Бубка в Чернігові;2021-10-11 05:34:24;
239;Змагання з легкоатлетичного кросу в Прилуках;2021-10-11 05:58:39;
240;Управління фітосанітарної безпеки підсумки роботи за 9 місяців - отримано 3 нотифікації;2021-10-11 06:11:10;
241;Мер Чернігова зустрівся з батьками дітей садочка №66. Що робиться для увімкнення там опалення?;2021-10-11 06:21:22;
242;Опалювальний сезон розпочався в Чернігові. Декілька бюджетних установ без опалення;2021-10-12 05:25:28;
243;Електронні лікарняні - роз’яснення МОЗ для паціентів;2021-10-12 05:48:47;
244;Зареєструйте право власності на землю, або вона стане комунальною власністю;2021-10-12 06:12:36;
245;Допомога з державного бюджету  на придбання житла для дітей-сиріт з Прилук;2021-10-12 06:32:20;
246;В Чернігові зник семикласник;2021-10-12 07:28:26;
247;Чернігівщина реалізувала власних продуктів на 10 млрд. гривень;2021-10-12 10:22:44;
248;Прилуцьку виховну колонію хочуть продати за 100 млн гривень;2021-10-13 05:25:08;
249;Порушення карантину фіксуватимуть спецкамери...;2021-10-13 04:52:02;
250;100 днів продажу землі, які результати на Чернігівщині;2021-10-13 06:17:52;
251;Чемпіонат Европи з САМБО наші на п’єдесталі;2021-10-13 06:45:31;
252;В Ніжині вчора почали демонтаж Літньої естради (фотозвіт);2021-10-13 08:35:53;
253;Міжобласні перевезення нещеплених українців без ПЛР-тесту заборонено Кабміном;2021-10-13 14:03:02;
254;Зниклого чернігівського семикласника знайшли в Івано-Франківську;2021-10-13 18:30:44;
255;У Новгород-Сіверському розпочали програму «Впливай на бюджет своєї громади»;2021-10-14 05:08:51;
256;У Борзні проводять вечірні рейди по виявленню правопорушень серед дітей;2021-10-14 05:25:23;
257;У Сосниці облагороджують парк Парк Пам’яті (фотозвіт);2021-10-14 05:44:09;
258;Українські аграрії лишились без нової сільхоз техніки;2021-10-14 06:15:18;
259;Белорусский контроль качества;;
260;Профспілка освітян м. Києва вимагає від КабМіну, МОЗ та Міносвіти не допустити порушення прав невакцинованих праціників;2021-10-14 15:21:25;
261;Директор Київської школи №210 Дмитро Ламза подав вже другий позов в суд проти КабМінУ;2021-10-14 15:15:28;
262;В Чернігові відкрили пам’ятник Захисникам України;2021-10-14 16:51:50;
263;Найдешевша на Чернігівщині сільгоспділянка коштувала всього 630 грн;2021-10-15 05:23:33;
264;"Носівка отримала новий авто ""швидкої""";2021-10-15 05:22:58;
265;В Семенівці триває битва за врожай (відео);2021-10-15 06:36:10;
266;Чернігів стає більш безпечним;2021-10-15 08:25:44;
267;З п’яти цукрових заводів на Чернігівщині залишився лише один;2021-10-15 08:56:02;
268;Приват Банк встановив ліміт на перекази з картки на карту.;2021-10-16 06:41:53;
269;Сільські бібліотеки Новгород-Сіверської териториальної громади отримали комп’ютери;2021-10-16 07:12:31;
270;На території Ніжинської школи №15 з'явилася траса для занять картингом;2021-10-16 07:43:23;
271;Змагання з футболу “Кубок Смолянки” в Комарівці Борзнянського району (фотозвіт);2021-10-16 14:37:25;
272;В Черниговской области появился новый комплекс фиксации нарушений ПДД;2021-10-16 15:03:41;
273;"""Колорит"""" з Варви - лауреати Міжнародного Фестивалю - конкурсу ""Kyiv art Fest""";2021-10-17 06:12:07;
274;Пестициди, якими обробляють поля - впливають на розвиток онкозахворювань;2021-10-17 06:28:51;
275;У срібному відкрито краєзнавчий музей;;
276;В Чернігові тарифи на опалення підіймати не будууть;2021-10-18 05:25:33;
277;Інвентарізація земель - Ріпкінська громада згодна прийняти ліс у комунальну власність;2021-10-18 06:13:59;
278;"12 жовтня у рамках кампанії ""Створюємо ліси разом!"" висаджено 10 285 сіянців лісових культур у Любецькому лісництві";2021-10-18 06:32:49;
279;Корюковская фабрика «Славянские обои – КФТБ»  снизила  уровень производства на 7,1%;2021-10-18 08:11:51;
280;Чернігівська «Юність» вдало обіграла у футбол своїх однолітків з Києва;2021-10-18 11:58:27;
281;За вирубку лісу на Чернігівщині судитимуть посадовців;2021-10-18 13:34:26;
282;Вчора 18.10 в Новгород-Сіверському обговорювали стратегію розвитку громади на 8 років.;2021-10-19 04:55:25;
283;Розіграш Суперкубку Борзнянської футбольної ліги 2021 рокув с. Кинашівка;2021-10-19 05:05:36;
284;Колективи Ніжинської хореографічної школи стали учаниками фестивалю «STARS OF TURKEY» в Анталії;2021-10-19 05:51:59;
285;В Ніжині є нічні маршрутки;2021-10-19 06:17:18;
286;В Чернігові рятувальники ліквідували загоряння вантажного автомобіля;2021-10-19 11:47:06;
287;Наталія Чистякова з Ніжина — чемпіонка світу з самбо;2021-10-19 11:37:54;
288;Ніжинтеплокомуненерго хоче, але не може;2021-10-20 04:24:09;
289;В Чернігові з’явиться новий сквер;2021-10-20 05:06:53;
290;Гаряча тема: ПІДВИЩЕННЯ ТАРИФІВ НА ОПАЛЕННЯ;2021-10-20 05:18:41;
291;Після нового року у громадському транспорті Чернігова почнуть впроваджувати електронний квиток;2021-10-20 08:12:37;
292;Завтра почнуть діяти нові правила пасажирських перевезень у регіонах із різними рівнями епіднебезпеки;2021-10-20 08:30:29;
293;В Ніжині з’являться цікаві інсталяції;2021-10-20 09:45:56;
294;У Прилуках відбулась зустріч з Уповноваженою Верховної Ради України з прав людини в Чернігівській області;2021-10-20 13:58:28;
295;У Ніжині цікавий івент: читатимуть Гоголя протягом доби;2021-10-21 04:55:06;
296;У дворі чернігівської ОДА хочуть побудувати житловий будинок;2021-10-21 05:22:24;
297;В Чернигове выращивают креветки (видео);2021-10-21 07:41:45;
298;Первый день ограничений Киевский автовокзал потерял 40% рейсов, проверки в Чернигове;2021-10-21 12:44:25;
299;Підприємці центрального ринку вирішували як працювати в локдаун (відео);2021-10-21 18:57:22;
300;В Нежине нашли деньги на отопление;2021-10-22 05:30:05;
301;В Чернигове презентовали «Серебряные оклады Евангелий XVII-XIX веков»;2021-10-22 07:35:09;
302;Чернігів відвідав Предстоятель Православної Церкви України, Блаженнійший Митрополит Епіфаній;2021-10-22 07:50:57;
303;95 свердловин для забезпечення жителів області якісною питною водою заплановано будувати на Чернігівщині;2021-10-22 13:43:52;
304;Новий потяг Варварівський - Гребінка запускають на Чернігівщині;2021-10-22 14:26:53;
305;В Ніжині відбувся міжнародний інвестиційний форум;2021-10-23 07:09:46;
306;Вперше за 50 років ремонтується дорога на ділянці Макиївка-Новий Биків на Чернігівщині;2021-10-23 09:26:03;
307;Поблизу села Хотинівка Ніжинського району браконьєри підстрелили фермера;2021-10-23 12:31:20;
308;60 дерев висадили по вул. Мстиславська в Чернігові;2021-10-24 07:36:19;
309;На дорозі Чернігів - Славутич готуються до капремонту 3 мостів;2021-10-24 07:44:13;
310;У Прилуках в бібліотеці ім. Л.Забашти презентували новий роман Олени Печорної;2021-10-24 10:03:33;
311;"Наявність сертифікату або ПЛР-тест у продавців та відвідувачів - умови для роботи ринку в ""червоній зоні""";2021-10-24 10:29:04;
312;У Борзнянському районі провели леогкотлетичні змагання «Олімпійські сходинки» (фотозвіт);2021-10-25 06:39:46;
313;Два нові ландшафтні заказники з’явилися на Чернігівщині;2021-10-25 07:58:26;
314;Недалеко от Смолина в Черниговском районе разрабатывают новое месторождение торфа;2021-10-25 13:45:13;
315;Розрахунок прожиткового мінімуму в Україні змінять.;2021-10-26 05:46:10;
316;Тариф на доставку газа может поднятся в 3 раза;2021-10-26 06:16:29;
317;У Семенівці продовжується битва за врожай;2021-10-26 12:45:17;
318;Чернігівщина рухається до безбар’єрності;2021-10-26 15:57:57;
319;Режим економії опалення хочуть запровадити у Чернігівських школах;2021-10-27 06:25:02;
320;Мешканець ніжинського району став жертвою кібер-злочинців;2021-10-27 06:54:35;
321;Вирішується доля Ніжинської районнної лікарні;2021-10-27 07:11:25;
322;У Качанівці альтанку Глібова рятують від руйнування;2021-10-27 10:45:54;
323;"Черниговская область в ""красной зоне"" как будет работать система образования";2021-10-27 15:44:05;
324;Як працюватиме громадський транспорт Чернігова у період карантину;2021-10-27 20:02:06;
325;На Чернігівщині СБУ викрила корупційну схему збагачення чиновників одного із комунальних лісгоспів;2021-10-28 06:43:31;
326;Переглянути механізм компенсацій місцевим бюджетам різниці у тарифах на тепло закликав уряд Владислав Атрошенко;2021-10-28 07:08:30;
327;Юлія Батура новий директор РЛП «Ялівщина»;2021-10-28 08:25:10;
328;60 річний ювілей відзначив інститут сільськогосподарської мікробіології та АПВ НААН м. Чернігіва;2021-10-28 08:41:05;
329;Правоохоронці проводять обшуки на комунальних підприємствах Чернігова;2021-10-28 12:37:19;
330;СБУ викрила посадовців Чернігівської міськради на розкраданні коштів;2021-10-28 18:07:28;
331;"30 - 31 жовтня - відкритий міський фестиваль-конкурс української патріотичної пісні ""ПОКЛИК СЕРЦЯ""";2021-10-29 05:16:40;
332;На Чернігівщині розпочався осінній призов на строову військову службу;2021-10-29 05:41:35;
333;Чернігівська ОДА ініціює інвентаризацію газових мереж;2021-10-29 05:49:37;
334;Чернігівська обласна рада звернулася до Уряду щодо стану річки Остер;2021-10-29 06:03:33;
335;"Як працюватимуть заклади культури в ""красній зоні""";2021-10-30 07:40:56;
336;Новая аллея возле дворца бракосочетания в Чернигове;2021-10-30 08:05:03;
337;ЦВК призначила довибори до Ради в окрузі №206;2021-10-30 08:10:45;
338;В Ніжині йде ремонт центральної частини міста (фотозвіт);2021-10-30 08:28:25;
339;Шоста частина земель сільськогосподарського призначення в Україні обробляється незаконно;2021-10-30 09:25:10;
340;На Черниговщине действует запрет на отлов рыбы;2021-10-31 09:03:19;
341;"Тролейбус №1 снова будет ходить до ""Сиверянки""";2021-10-31 09:14:44;
342;В Прилуках за долги хотят отрезать канализацию;2021-10-31 10:57:23;
343;"Податкова у Чернігівській області викритла ""схему""на суму 4,4 млн гривень";2021-10-31 14:46:13;
344;Первые последствия ограничений для жителей Чернигова;;
345;Лідери громадських обє’днань Чернігівщини зібрались в Ніжині на обговорення;2021-11-01 07:27:05;
346;Чернігівський дітсадок №66 досі без опалення чи закриють заклад?;2021-11-01 07:42:01;
347;Діджиталізація Ніжинської міськради триває - електронний обіг документів (відео);2021-11-01 07:56:13;
348;При пополнении електронной транспортной карты в Чернигове с 1 ноября взымается комисия;2021-11-01 08:51:07;
349;В Україні хочуть почати щепити від Коронавірусу дітей віком від 12 років;2021-11-01 10:48:25;
350;До 27 листопада вул. Київську в Чернігові буде перекрито;2021-11-01 11:02:22;
351;Пограничники Черниговского отряда задержали нарушителя;;
352;Чернігівські медики планують придбати пересувний мамографічний комплекс;2021-11-01 14:50:29;
353;Дожилися..... Европейці підроблюють білоруські краски;2021-11-01 18:35:49;
354;Мер Чернігова вимагає від влади справедливих компенсацій різниці у тарифах на газ для мешканців міста;2021-11-02 09:32:07;
355;Новгород-Сіверський міський голова Людмила Ткаченко отримала подарунок - нове авто Renault SANDERО;2021-11-02 10:00:03;
356;Наши чемпионы;2021-11-02 10:38:50;
357;Семінар-наради для директорів навчальних закладів, дитячих садків щодо впровадження системи безпечного і здорового харчування у закладах освіти;2021-11-02 12:22:53;
358;З Ічні на Прилуки поїздом в тому числі для пільгових категорій громадян;2021-11-02 13:58:56;
359;На порозі транспортного колапсу - у Прилуках зупинка метанової заправки;2021-11-03 06:39:05;
360;Навіщо газові труби хочуть передати громадам? Чи не перекладають відповідальність за ремонт на плечі пересічних громадян?;2021-11-03 07:50:33;
361;В Києві проходять масові митинги проти обмеження прав людей при застосуванні локдауну (відео);2021-11-03 11:02:02;
362;У Пакулі Чернігівського району висаджували дерева;2021-11-04 06:56:38;
363;ДТП біля Количівки - загинув 34-річний пасажир;2021-11-04 09:35:14;
364;Борьба за сохранение Семеновского лесхоза семеновцы вышли под КабМин;2021-11-04 10:21:44;
365;Е-лікарняний: актуальна інформація для громадян;2021-11-04 12:56:12;
366;Три дні без газу - жителі Понорниці перекривали трасу Чернігів-Гремяч для виришення питання;2021-11-04 13:14:02;
367;"в Чернигове мошенники ""разводят"" детей на деньги";2021-11-04 14:20:12;
368;Нову уніфіковану методику оцінки земель ухвалив уряд;2021-11-05 07:20:31;
369;Де в Чернігові можна повірити лічильники води без демонтажу?;2021-11-05 07:47:34;
370;Тупичівська сільска рада допомогає ремонтувати будинок культури у Вихвостові;2021-11-05 09:15:52;
371;Ніжин зустрів почесних гостей з Польщі;2021-11-05 14:05:25;
372;У Носівці ремонтують стадіон (фотозвіт);2021-11-06 07:27:18;
373;Працівнику поліції Чернігівської області повідомлено про підозру - при затриманні жорстоко побив чоловіка;2021-11-06 08:02:03;
374;Терцентр Монастирищенської міської ради - працівникам соціальної служби вручені два велосипеди та п’ять тонометрів;2021-11-06 08:17:54;
375;У Ніжині скаржаться на аварійні дороги (фотозвіт);2021-11-07 07:04:10;
376;Податки для підприємців в Україні зростуть;2021-11-07 07:39:41;
377;Соревновани по автомодельному спорту проходили в Чернигове;2021-11-07 11:08:14;
378;"На Черниговщине в парке природы ""Беремицкое"" будут разводить благородных оленей.";2021-11-08 06:17:54;
379;Почему оформить субсидии стало тяжелее;2021-11-08 06:52:05;
380;В нежинском районе пробемы с связью;2021-11-08 09:04:05;
381;Чернігів змінюється на краще;2021-11-09 05:33:24;
382;На Чернігівщині з 6 листопада почався сезон полювання;2021-11-09 05:32:50;
383;Сьогодні день української писемності та мови;2021-11-09 09:39:29;
384;Почему мировые цены на продукты будут рости и дальше поясняет экономист;2021-11-09 12:50:11;
